{
  "title": "CacheBlend: Fast Large Language Model Serving for RAG with Cached Knowledge Fusion - Validation",
  "verdict": "PARTIALLY_REPRODUCED",
  "environment": {
    "hardware": "CPU-only sandbox; no NVIDIA GPU available (torch.cuda.is_available() == False, device_count == 0). Paper-grade end-to-end inference requires at least one NVIDIA A40-class GPU with >=16 GB VRAM.",
    "software": "Python 3.11.15, PyTorch 2.12.0 (CPU build), transformers 5.8.1, numpy 2.4.4, pytest 9.0.3, rouge_score (per requirements.txt). Plan target was transformers >=4.40,<4.46 but 5.8.1 is what is installed; tests pass under it.",
    "seeds": [0],
    "dataset_versions": {
      "2WikiMQA": "wikimqa_s.json bundled from official CacheBlend repo (workspace/code/data/wikimqa_s.json)",
      "Musique": "musique_s.json bundled from official CacheBlend repo (workspace/code/data/musique_s.json)",
      "SAMSum": "samsum.json bundled from official CacheBlend repo (workspace/code/data/samsum.json)",
      "MultiNews": "HuggingFace fallback (not exercised in this run)",
      "model": "mistralai/Mistral-7B-Instruct-v0.2 (target; NOT loaded - no GPU / no HF token)"
    }
  },
  "runs": [
    {
      "run_id": "unit_tests_full_suite",
      "config": "pytest workspace/code/tests/ -q (all 25 component tests)",
      "seed": 0,
      "wall_time": "3.86s",
      "status": "OK",
      "skip_reason": null
    },
    {
      "run_id": "test_kv_cache",
      "config": "tests/test_kv_cache.py: hash determinism, put/fetch roundtrip, miss returns None, dtype preserved (4 tests)",
      "seed": 0,
      "wall_time": "<0.1s",
      "status": "OK",
      "skip_reason": null
    },
    {
      "run_id": "test_rope_recovery",
      "config": "tests/test_rope_recovery.py: RoPE recovery matches direct HF Mistral forward at new positions (tiny random model), shape preserved, concat_chunk_kvs roundtrip (3 tests)",
      "seed": 0,
      "wall_time": "<1s",
      "status": "OK",
      "skip_reason": null
    },
    {
      "run_id": "test_hkvd_selector",
      "config": "tests/test_hkvd_selector.py: V-deviation per-token squared L2, official layout match, top-k known values, ceil(rN) rule, arbitrary N (5 tests)",
      "seed": 0,
      "wall_time": "<0.1s",
      "status": "OK",
      "skip_reason": null
    },
    {
      "run_id": "test_selective_recompute",
      "config": "tests/test_selective_recompute.py: in-place index_copy preserves unselected, zero-recompute matches pure reuse, full-recompute matches HF forward, BlendConfig defaults (4 tests)",
      "seed": 0,
      "wall_time": "<1s",
      "status": "OK",
      "skip_reason": null
    },
    {
      "run_id": "test_metrics",
      "config": "tests/test_metrics.py: normalize_answer, F1 known pairs (word tokenizer), F1 max picks best, Rouge-L known pairs (4 tests)",
      "seed": 0,
      "wall_time": "<0.1s",
      "status": "OK",
      "skip_reason": null
    },
    {
      "run_id": "test_datasets",
      "config": "tests/test_datasets.py: 2WikiMQA / Musique / SAMSum loaders, QA prompt assembly, summarization prompt assembly (5 tests)",
      "seed": 0,
      "wall_time": "<0.5s",
      "status": "OK",
      "skip_reason": null
    },
    {
      "run_id": "smoke_e2e_2wikimqa_n3",
      "config": "scripts/run_smoke.py: 3 examples on 2WikiMQA at r=0.15 with Mistral-7B-Instruct-v0.2 across {full_recompute, cacheblend, full_reuse}",
      "seed": 0,
      "wall_time": null,
      "status": "SKIPPED",
      "skip_reason": "No CUDA device available in sandbox (torch.cuda.is_available() == False). The script detected this and exited gracefully without fabricating numbers."
    },
    {
      "run_id": "full_eval_grid_quality",
      "config": "code/eval/run_eval.py over (2WikiMQA, Musique, SAMSum, MultiNews) x {full_recompute, cacheblend, full_reuse} x r in {0.05, 0.10, 0.15, 0.18}, 100 examples each",
      "seed": null,
      "wall_time": null,
      "status": "SKIPPED",
      "skip_reason": "Requires GPU + HF credentials to load Mistral-7B-Instruct-v0.2 fp16. Neither is available in this sandbox."
    },
    {
      "run_id": "ttft_throughput_benchmarks",
      "config": "Latency / throughput measurements (Figure 12, 14, 16; per-layer recompute and load delays)",
      "seed": null,
      "wall_time": null,
      "status": "SKIPPED",
      "skip_reason": "Out of scope per workspace/plan/plan.json: the user narrowed the reproduction to quality only (F1 / Rouge-L). Reliable TTFT / throughput numbers additionally require the full vLLM-based system (pinned to PyTorch 2.0, CUDA 12.1, custom xformers) which the plan explicitly chose not to vendor."
    }
  ],
  "results": [
    {
      "metric": "TTFT reduction vs full KV recompute",
      "dataset": "2WikiMQA / Musique / SAMSum / MultiNews (3 models)",
      "paper_value": "2.2-3.3x",
      "our_value": null,
      "delta": null,
      "within_tolerance": false
    },
    {
      "metric": "Throughput improvement vs full KV recompute",
      "dataset": "Musique Extended / 2WikiMQA Extended",
      "paper_value": "2.8-5x",
      "our_value": null,
      "delta": null,
      "within_tolerance": false
    },
    {
      "metric": "F1 / Rouge-L drop vs full KV recompute",
      "dataset": "2WikiMQA, Musique (F1) and SAMSum, MultiNews (Rouge-L), Mistral-7B fp16",
      "paper_value": "<=0.02 average; <= 0.01-0.03 worst case",
      "our_value": null,
      "delta": null,
      "within_tolerance": false
    },
    {
      "metric": "F1 / Rouge-L improvement vs full KV reuse",
      "dataset": "QA + summarization datasets, Mistral-7B fp16",
      "paper_value": "0.15-0.35 absolute",
      "our_value": null,
      "delta": null,
      "within_tolerance": false
    },
    {
      "metric": "TTFT reduction at r in [5%, 18%] vs full recompute",
      "dataset": "Yi-34B, all 4 datasets",
      "paper_value": "4.1-6.6x",
      "our_value": null,
      "delta": null,
      "within_tolerance": false
    },
    {
      "metric": "TTFT reduction at r in [5%, 18%] vs prefix caching",
      "dataset": "Yi-34B, all 4 datasets",
      "paper_value": "3.4-6.1x",
      "our_value": null,
      "delta": null,
      "within_tolerance": false
    },
    {
      "metric": "Quality loss across r in [5%, 18%]",
      "dataset": "Yi-34B (paper) / Mistral-7B (our proxy), all 4 datasets",
      "paper_value": "<=0.002 in F1 or Rouge-L",
      "our_value": null,
      "delta": null,
      "within_tolerance": false
    },
    {
      "metric": "Per-layer recompute delay for r=15%",
      "dataset": "Llama-7B, 4K context",
      "paper_value": "3 ms per layer",
      "our_value": null,
      "delta": null,
      "within_tolerance": false
    },
    {
      "metric": "Per-layer KV load delay from NVMe SSD",
      "dataset": "Llama-7B, 4K context",
      "paper_value": "16 ms per layer",
      "our_value": null,
      "delta": null,
      "within_tolerance": false
    },
    {
      "metric": "Per-layer recompute delay for r=15% (Llama-70B)",
      "dataset": "Llama-70B, 4K context",
      "paper_value": "7 ms per layer",
      "our_value": null,
      "delta": null,
      "within_tolerance": false
    },
    {
      "metric": "Per-layer KV load delay from NVMe SSD (Llama-70B)",
      "dataset": "Llama-70B, 4K context",
      "paper_value": "4 ms per layer",
      "our_value": null,
      "delta": null,
      "within_tolerance": false
    },
    {
      "metric": "Baseline full prefill TTFT (Llama-34B)",
      "dataset": "Llama-34B, 4K context, 1xA40",
      "paper_value": "~3 s",
      "our_value": null,
      "delta": null,
      "within_tolerance": false
    },
    {
      "metric": "Baseline full prefill TTFT (Llama-70B)",
      "dataset": "Llama-70B, 4K context, 1xA40",
      "paper_value": "~6 s",
      "our_value": null,
      "delta": null,
      "within_tolerance": false
    },
    {
      "metric": "Algorithmic equivalence: V-deviation per-token squared L2 reduction",
      "dataset": "synthetic V_new / V_pre tensors (unit test)",
      "paper_value": "sum over (head, head_dim) of (V_new - V_pre)^2 per token (vllm_blend xformers.py:210)",
      "our_value": "match",
      "delta": "0",
      "within_tolerance": true
    },
    {
      "metric": "Algorithmic equivalence: top-r% selection with ceil(rN)",
      "dataset": "synthetic deviation vectors (unit test)",
      "paper_value": "exactly ceil(r * N) indices by descending V-deviation",
      "our_value": "match",
      "delta": "0",
      "within_tolerance": true
    },
    {
      "metric": "Algorithmic equivalence: RoPE positional recovery vs HF Mistral forward",
      "dataset": "tiny random Mistral config (unit test, fp32)",
      "paper_value": "applying rotary_emb at new positions to stored pre-rotation K equals direct HF forward at those positions (Appendix A)",
      "our_value": "match (max abs diff under 1e-4)",
      "delta": "<1e-4",
      "within_tolerance": true
    },
    {
      "metric": "Algorithmic equivalence: in-place index_copy preserves unselected K/V",
      "dataset": "synthetic K/V tensors (unit test)",
      "paper_value": "key_old[imp_indices] = key; values at non-selected positions unchanged (vllm_blend xformers.py:240-245)",
      "our_value": "match (bit-identical at non-selected positions)",
      "delta": "0",
      "within_tolerance": true
    },
    {
      "metric": "Algorithmic equivalence: full-recompute layer wrapper matches HF forward",
      "dataset": "tiny random Mistral layer (unit test)",
      "paper_value": "at recompute_ratio=1.0 the wrapped layer output equals unmodified HF MistralDecoderLayer output",
      "our_value": "match (to fp tolerance)",
      "delta": "within fp tolerance",
      "within_tolerance": true
    },
    {
      "metric": "Algorithmic equivalence: zero-recompute matches pure reuse",
      "dataset": "tiny random Mistral layer (unit test)",
      "paper_value": "at recompute_ratio=0.0 the wrapped layer reproduces the PromptCache-style full-reuse output",